{
  "id": "mumbai_prop_vadapav_cart_fixed_canopy_right_neutral_1x_v001",
  "city": "mumbai",
  "category": "prop",
  "dimensions": {
    "width": 1120,
    "height": 1582,
    "unit": "px"
  },
  "collision": {
    "type": "none",
    "solid": false
  },
  "placementWeight": 0,
  "placementRules": {
    "allowedZones": [
      "non_playable_edge_right"
    ],
    "blockedZones": [
      "safety_buffer",
      "playable_road"
    ],
    "minSpacing": 0,
    "alignTo": "road_facing_edge_left",
    "notes": "Service faces left; structural depth extends right. Session 46 measured the pivot and bounds against the delivered binary and passed Test A (single-asset runtime placement). minSpacing and placementWeight stay 0: no procedural pool and no segment composer exist yet, so this record must still not enter a runtime pool. Provisional runtime spacing lives in EDGE_PROP_DEFS in game.js."
  },
  "anchor": {
    "x": 276,
    "y": 1057,
    "origin": "custom"
  },
  "lightingCompatibility": [],
  "biomeCompatibility": [
    "mumbai"
  ],
  "tags": [
    "source_brief_pab_mumbai_envprop_vada_pav_cart_v1",
    "family_mumbai_prop_vadapav_cart_v001",
    "subcategory_street_commerce_food_cart",
    "gameplay_tier_4",
    "variant_fixed_canopy",
    "orientation_right_edge",
    "orientation_class_c_dedicated_master",
    "service_direction_left",
    "city_direction_right",
    "road_facing_edge_left",
    "city_facing_edge_right",
    "runtime_mirroring_prohibited",
    "pivot_road_facing_ground_contact_centre",
    "micro_cluster_anchor",
    "transparent_background_required",
    "creative_direction_approved",
    "repository_export_pending",
    "runtime_integration_pending",
    "version_1"
  ],
  "status": "draft",
  "notes": "PAB-MUMBAI-ENVPROP-VADA-PAV-CART-V1. dimensions and anchor are now MEASURED from the delivered binary (Session 46, 2026-08-07): canvas 1120x1582; silhouette 226,432-950,1057 at alpha>=32; footprint 276,950-876,1057; pivot 276,1057 = road_facing_ground_contact_centre. NOTE: the session45 export manifest's visible_bounds_px [48,48,1072,1534] is a canvas-inset claim, not the silhouette - do not size from it. placementWeight 0 remains the disable sentinel: Test A (single-asset placement) passed, but mixed placement and the segment composer are pending, so this asset is NOT integrated into production. See docs/art-production/PROCEDURAL_PLACEMENT.md#test-a--single-asset."
}
