{
  "id": "mumbai_prop_storage_matka_vessel_single_neutral_1x_v001",
  "city": "mumbai",
  "category": "prop",
  "dimensions": {
    "width": 1254,
    "height": 1254,
    "unit": "px"
  },
  "collision": {
    "type": "none",
    "solid": false
  },
  "placementWeight": 0,
  "placementRules": {
    "allowedZones": [
      "non_playable_edge_left",
      "non_playable_edge_right"
    ],
    "blockedZones": [
      "safety_buffer",
      "playable_road"
    ],
    "minSpacing": 0,
    "notes": "Session 61 Phase 2: real geometry, no longer a disabled draft. placementWeight/minSpacing stay 0 for the same reason as every other master in this repo: no procedural pool reads this field directly — runtime weight/spacing comes from EDGE_PROP_DEFS (mumbai_storage_matka_vessel_right/left)/productionClaims()/attachmentY() in game.js, not from this record."
  },
  "anchor": {
    "x": 566,
    "y": 1132,
    "origin": "custom"
  },
  "lightingCompatibility": [],
  "biomeCompatibility": [
    "mumbai"
  ],
  "tags": [
    "source_brief_pab_mumbai_envprop_storage_attachment_v1",
    "subcategory_street_commerce_storage_utility",
    "gameplay_tier_4",
    "role_attachment_secondary",
    "variant_matka_vessel",
    "orientation_neutral_verified",
    "orientation_class_a_same_binary_both_edges",
    "runtime_mirroring_prohibited",
    "geometry_measured_session_61_phase_2",
    "footprint_pivot_measured",
    "session_56_geometry_contract_passed_marginal",
    "declared_max_height_corrected_down",
    "payload_optimized_session_61_phase_2",
    "pending_pm_runtime_review"
  ],
  "status": "review",
  "notes": "PAB-MUMBAI-ENVPROP-STORAGE-ATTACHMENT-V1, Storage Vessel master. PM-selected Candidate 2 (masala_run_storage_vessel_candidate2.png in ~/Documents/Working images/, left untouched). Source verified before integration: real RGBA alpha (extrema 0/255), single connected component at alpha>=32 (555,843px, zero stray islands), no baked shadow/glow/background found on visual inspection. No creative cleanup was needed or performed. Repo copy assets/props/mumbai_prop_storage_matka_vessel_single_neutral_1x_v001.png is the untouched-pixel-content source recompressed by tools/optimize_prop_master.py (764176B -> 65688B, strategy D/256, written as an indexed-palette PNG with tRNS alpha, maxDelta 28/mean 2.26) — that tool's own alpha>=32 mask-bit-identity check passed, so all bounds below (measured pre-recompression) remain valid. Own-pixel measurements: canvas 1254x1254; visualBounds (alpha>=32, main connected component) = (295,91)-(958,1132); footprint = bottom 4px ground-contact band = (566,1128)-(686,1132). IMPORTANT GEOMETRY FINDING: this object is a rounded vessel rendered from a steep bird's-eye tilt, so its silhouette bulges wide at the belly (the widest row, near y~491, IS visualBounds.x0/x1) then tapers to a narrow base (footprint) — a real geometric fact confirmed stable across footprint-band widths 2-12px (intrusion swings only 5.87-7.17px @ 26px in every case), not a measurement artifact or a manipulated pivot. roadIntrusion @ heightPx 26 (shipped value) = 6.77-6.79px (right/left) — PASSES the 8px hard cap but sits ABOVE the 5.6px preferred-guidance band, closer to the ceiling than any other registered master in this repo. The brief's originally declared 36px maximum runtime height is NOT achievable: @36px intrusion is 9.37-9.41px, over the 8px hard cap. Solving for the cap gives a true safe ceiling of ~30.7px (heightPx = 8 * 1041 / 308) — barely above the 26px target itself, essentially zero headroom. This correction is recorded here rather than silently keeping the brief's 36px figure or forcing a pass by moving the pivot (both explicitly prohibited by the Phase 2 spec). Shipped at heightPx 26 ONLY; do not scale this master up without remeasuring the footprint band. cropSafe = visualBounds +/-48px clamped to canvas = (247,43)-(1006,1180). Orientation-neutral VERIFIED from pixels: mirroring the alpha>=32 crop gives mean alpha diff 0.39/255 (silhouette essentially exact-symmetric) and mean RGB diff 9.15/255 where both sides are opaque (a subtle painterly highlight only, not a directional handle/spout/service-side). Horizontal silhouette centre measured at 626.5-627.0 out of the 1254-wide canvas (dead centre) at every sampled row including the footprint band. Per the brief's Class-A-neutral policy, this ONE binary is registered under TWO EDGE_PROP_DEFS keys (mumbai_storage_matka_vessel_right, pivot=(566,1132); mumbai_storage_matka_vessel_left, pivot=(686,1132), the mirror-image boundary of the SAME measured footprint) — no runtime mirror transform, matching the repo-wide prohibition. `anchor` above records the right-edge canonical pivot. tall:false (attachment scale, well under the 70px courier floor). Registered in game.js as EDGE_PROP_DEFS.mumbai_storage_matka_vessel_right / _left and added to PRODUCTION_CATALOGUE_KEYS, role:\"attachment\", replacing the Session 60 mumbai_attachment_probe_right_test/left_test harness (deleted). Runtime day/night render, composer admission/rejection proof, and regression suite are recorded in CHANGELOG.md's Session 61 Phase 2 entry, not duplicated here. PM visually approved this candidate pre-integration; runtime/integration visual sign-off is a separate, still-open step, so status is held at 'review', not 'approved', consistent with every other master in this repo's gate convention. Brief follow-up (2026-08-15, PAB-MUMBAI-ENVPROP-STORAGE-ATTACHMENT-V1 1.1 -> 1.2): the brief's Section G/H declared-maximum-runtime-height field for this master is now written as 26px directly (equal to target, no headroom), not left as an appended clarification against an uncorrected 36px figure. No change to this record's geometry, the game.js runtime height, or the binary -- documentation-only correction, same numbers as above."
}
